{
  "version": 1,
  "schema": "libs/runtime-manifest/schemas/webhook/run-loop.v1.schema.json",
  "id": "review-pr/gitlab-synapse",
  "title": "Review Synapse merge request",
  "agent": "agent-reviewer",
  "description": "Posts the GitLab merge request webhook payload and follows the review flow.",
  "ingress": {
    "kind": "webhook",
    "method": "POST",
    "path": "/v1/prs",
    "headers": {
      "X-Gitlab-Event": "Merge Request Hook"
    },
    "body": {
      "file": "fixtures/agent-reviewer/gitlab-merge-request.json"
    }
  },
  "expect": {
    "rootEventType": "pr.received.v1",
    "eventTypes": ["pr.received.v1", "pr.reviewed.v1"],
    "terminalEventTypes": ["pr.reviewed.v1"]
  }
}
