{
  "version": 1,
  "schema": "libs/runtime-manifest/schemas/webhook/run-loop.v1.schema.json",
  "id": "example/echo",
  "title": "Echo ping",
  "agent": "example-echo",
  "ingress": {
    "kind": "webhook",
    "method": "POST",
    "path": "/v1/examples/echo/ping",
    "body": {
      "file": "examples/fixtures/example-agent-echo/ping.json"
    }
  },
  "expect": {
    "rootEventType": "example.ping.v1",
    "eventTypes": ["example.ping.v1", "example.pong.v1"],
    "terminalEventTypes": ["example.pong.v1"]
  }
}
